{
  "feed_version": 1,
  "generated_at": "2026-10-28T12:25:50Z",
  "source": {
    "repository": "geonodecom/geonode-integrations-management",
    "revision": "db8c56d"
  },
  "categories": [
    {
      "id": "ai-agents",
      "label": "AI & Agents"
    },
    {
      "id": "sdks",
      "label": "SDKs"
    },
    {
      "id": "frameworks",
      "label": "Frameworks"
    },
    {
      "id": "automation",
      "label": "Automation"
    },
    {
      "id": "api",
      "label": "API"
    },
    {
      "id": "cli",
      "label": "CLI"
    }
  ],
  "lifecycle_labels": {
    "published": "Available",
    "private": "Private app",
    "planned": "Coming soon",
    "audit-required": "In review"
  },
  "integrations": [
    {
      "schema_version": 1,
      "id": "api",
      "slug": "api",
      "name": "REST API",
      "category": "api",
      "summary": "Extract pages, crawl sites and search the web over HTTP.",
      "seo_title": "Geonode Scraper API — Web Scraping, Crawling & Search",
      "developer_overview": {
        "connection": [
          {
            "label": "Base URL",
            "value": "https://scraper.geonode.io"
          },
          {
            "label": "Authentication",
            "value": "X-Api-Key: <your-api-key>"
          },
          {
            "label": "Request format",
            "value": "application/json"
          }
        ],
        "operations": [
          {
            "name": "Extract",
            "method": "POST",
            "path": "/v1/extract",
            "input": "A URL, output formats and optional browser rendering.",
            "output": "Markdown or HTML with metadata; a job ID in async mode.",
            "docs": "https://docs.geonode.com/docs/scraper-api/v1/extraction/extract-content"
          },
          {
            "name": "Batch",
            "method": "POST",
            "path": "/v1/batch",
            "input": "A list of URLs and extraction options.",
            "output": "A job ID and accepted URL count. Retrieve results when complete.",
            "docs": "https://docs.geonode.com/docs/scraper-api/v1/batch/start-batch-job"
          },
          {
            "name": "Crawl",
            "method": "POST",
            "path": "/v1/crawl",
            "input": "A seed URL, maximum depth and page limit.",
            "output": "A job ID. Retrieve extracted pages as the crawl completes.",
            "docs": "https://docs.geonode.com/docs/scraper-api/v1/crawl/start-crawl-job"
          },
          {
            "name": "Map",
            "method": "POST",
            "path": "/v1/map",
            "input": "A base URL and optional discovery filters.",
            "output": "Discovered URLs and their sources, without page content.",
            "docs": "https://docs.geonode.com/docs/scraper-api/v1/map/map-urls"
          },
          {
            "name": "Search",
            "method": "POST",
            "path": "/v1/search",
            "input": "A query, with optional locale, page and search filters.",
            "output": "Search results, suggestions and a search job ID.",
            "docs": "https://docs.geonode.com/docs/scraper-api/v1/search/start-search-job"
          }
        ],
        "behavior": [
          {
            "title": "Synchronous requests and background jobs",
            "description": "Extraction supports sync and async modes. Batch and crawl return a job ID; poll for completion and paginate results. Webhooks can notify your service when a job finishes.",
            "docs": "https://docs.geonode.com/docs/scraper-api/guides/jobs/02_checking_job_status",
            "link_label": "Job lifecycle"
          },
          {
            "title": "Rendering and usage",
            "description": "Enable render_js when the page requires a browser. Rendering is slower and uses more credits. Keep API keys on your server; usage is charged to your Geonode account.",
            "docs": "https://docs.geonode.com/docs/scraper-api/v1/extraction/extract-content",
            "link_label": "Extraction options"
          },
          {
            "title": "Errors and retries",
            "description": "Handle authentication, validation and balance errors explicitly. Respect Retry-After on rate limits. A timed-out submission may still have created a job; avoid blindly submitting it again.",
            "docs": "https://docs.geonode.com/docs/scraper-api/troubleshooting/error-handling",
            "link_label": "Error handling"
          }
        ]
      },
      "description": "Send JSON requests from your backend. Get Markdown, HTML or URLs back directly, or retrieve results from a background job.",
      "lifecycle": "published",
      "platform_verification": "not-applicable",
      "platform": "HTTP",
      "version": null,
      "runtime": "HTTPS client",
      "last_verified": "2026-10-22",
      "verification": {
        "package": "not-applicable",
        "connection": "not-tested",
        "note": "Official API documentation is available. Authenticated requests have not been run in this review. Capability copy checked against the official API reference and the developer-docs OpenAPI contract on 2026-10-22; this was a documentation review, not an authenticated execution test. Endpoint inputs, outputs and modes reviewed against the developer-docs OpenAPI contract on 2026-10-22.",
        "evidence": [
          "https://docs.geonode.com/docs/scraper-api/v1/reference"
        ]
      },
      "capabilities": {
        "confirmed": [
          "Extract webpage content as Markdown or HTML.",
          "Process multiple URLs together with batch extraction.",
          "Crawl a website and retrieve the resulting pages.",
          "Discover website URLs before choosing what to extract.",
          "Search the web for pages relevant to your query.",
          "Track background jobs and receive completion notifications through webhooks."
        ],
        "planned": []
      },
      "auth": {
        "supported": [
          "api-key"
        ],
        "oauth_status": "not-supported",
        "note": "Keep API keys on the server or in your client’s credential store. Usage is charged to your Geonode plan."
      },
      "installation": {
        "command": null,
        "status": "documented",
        "note": "Use the official setup documentation."
      },
      "links": {
        "website": "https://geonode.com/integrations/api",
        "docs": "https://docs.geonode.com/docs/scraper-api/v1/reference",
        "source": null,
        "package": null,
        "changelog": null,
        "support": "https://geonode.com/contact"
      },
      "use_cases": [
        {
          "title": "Build with your own stack",
          "description": "Use standard HTTP requests from a language or platform of your choice."
        },
        {
          "title": "Connect a custom service",
          "description": "Integrate asynchronous extraction and completion webhooks into your service."
        }
      ],
      "prerequisites": [
        "HTTPS client",
        "A Geonode API key and an active plan for authenticated requests."
      ],
      "troubleshooting": [
        {
          "question": "My API key is not accepted.",
          "answer": "Check the key in the Geonode dashboard and send it using X-Api-Key. Keep it out of browser bundles, URLs and version control."
        },
        {
          "question": "The request is rate limited.",
          "answer": "Respect the Retry-After response and your plan’s concurrency limits. Avoid automatically retrying a job submission when its outcome is unknown."
        }
      ],
      "related": [
        "python",
        "typescript",
        "cli"
      ],
      "logo": null,
      "guide": {
        "intro": "Call the Geonode Scraper API directly from any HTTP client. Use this route when your language has no dedicated SDK or you want to control the request and response handling yourself.",
        "sections": [
          {
            "title": "Make one synchronous request",
            "paragraphs": [
              "Provide your API key through GEONODE_SCRAPER_API_KEY in the environment. Send JSON to the extraction endpoint with the X-Api-Key header."
            ],
            "code": {
              "label": "CURL · EXTRACT MARKDOWN",
              "value": "curl --request POST \"https://scraper.geonode.io/v1/extract\" \\\n  --header \"Content-Type: application/json\" \\\n  --header \"X-Api-Key: ${GEONODE_SCRAPER_API_KEY}\" \\\n  --data '{\"url\":\"https://example.com\",\"formats\":[\"markdown\"],\"processing_mode\":\"sync\"}'"
            },
            "expected": "A successful synchronous extraction returns page content under data.markdown and usage under tokens_charged. Read the HTTP status and error body before treating a response as a result."
          },
          {
            "title": "Design for jobs and usage limits",
            "steps": [
              "Use asynchronous extraction, batches or crawls for longer work. Save the returned job ID and follow its status to completion, failure or cancellation.",
              "Set explicit page and depth limits on crawls and paginate result sets.",
              "Handle rate limits using Retry-After. Avoid resubmitting a job blindly if the original request timed out after submission.",
              "If you use webhooks, validate signatures and handle duplicate deliveries before updating downstream records."
            ]
          }
        ]
      }
    },
    {
      "schema_version": 1,
      "id": "mcp",
      "slug": "mcp",
      "name": "Geonode MCP Server",
      "category": "ai-agents",
      "summary": "Web search and content collection for MCP-compatible agents.",
      "seo_title": "Geonode MCP Server — Web Scraping for AI Assistants",